Review,Date
"Хотелось бы поблагодарить банк Тинькофф, в частности сотрудницу Викторию ( внутренний номер 594077)  за внимание к сложившейся проблеме и помощи в ее решении. Уже не первый раз убеждаюсь, что банк слышит своих клиентов и всегда реагирует и старается помочь, один из лучших банков в стране, как по уровню обучения персонала, так и по решению вопросов в пользу клиентов. Виктория очень быстро вникла в вопрос, принесла извинения за действия сотрудника, который дал не совсем верную консультацию и в качестве извинений банк начислил 500 рублей с подписью ""Мы Вас ценим"". Это безумно приятно. Желаю банку процветания, дальнейшего профессионального обучения персонала, продолжать перенимать зарубежный высокий опыт обслуживания, до которого многим российским банкам еще расти и расти. Профессиональная поддержка 24/7, премиум-поддержка на премиум уровне!",2024-03-30 12:36:20
"Я написал в чат 30.03.2024 в 00:42, и мне ответил Данияр. У меня возникла проблема с начислением 10% кэшбэка за покупку в магазине: Улыбка радуги. Оказывается, чтобы его получить, нужно было произвести оплату на сайте или в приложении. Так как я оплатил в магазине, то мне его не начислили. После обращения в чат мне пошли на встречу и выплатили кэшбэк. Хочу выразить благодарность банку и оператору за лояльное отношение к своим клиентам.",2024-03-30 11:00:29
"28.03.24. купила товар, на который у меня кэшбэк, но чек остался в магазине. На следующий день взяла в магазине копию чека с распечаткой всех товаров и всеми реквизитами, но без QR- кода (на копии его просто не бывает). Отослала фото копии чека. Но консультант Сергей отклонил мою заявку на кэшбэк. Да, 222 рубля (размер кэшбэка), которые мне не начислили, не такие большие деньги. Но обидно, что проблема невелика, но решить её в пользу клиента банк не может. Неужели не нужны клиенты. Буду рассматривать другие банки для сотрудничества.",2024-03-30 10:56:53
Здравствуйте. Обращался в поддержку Тинькофф По вопросу списания средств без моего согласия 29.03.2024 время 01:08 мой вопрос был услышан и за сутки пришли деньги обратно  Спасибо большое банку Тинькофф и его сотрудникам) к сожалению имени не запомнил но тем не менее всем благодарен и советую обращаться  ,2024-03-30 10:36:01
"С Банком Тинькофф работаю как физ лицо длительное время. Решил здесь же открыть расчётный счёт. Очень доволен сотрудничеством. Быстро отвечают в приложении сотрудники (операторы), помогают при настройках как самого приложения, так и услуг по тарифу. Сотрудничал до Тинькофф с парой других банков (не буду сообщать с какими), после них осадок, разошлись. Советую этот банк - он у меня основной. Здесь у меня расчётный счёт, инвестиционный, дебетовый и кредитный.",2024-03-30 09:41:16
"Произошла очень странная ситуация, в в разделе акции у Вас указано, что при  бронировании и оплате Яндекс путешествий кэбэк 10%. Перехожу по ссылке, все делаю согласно Вашему же описанию. И что в итоге? Он конечно не приходит. Поддержка морозится, - сам дурак не так все сделал. А других вариантов как сделать нет. Перешел по ссылке - забронировал - оплатил ? Что за бред?? Первый раз такое с этим банком. Ранее когда были ошибка в начислении всегда исправляли, ту что не так??? ",2024-03-30 09:03:38
"В августе 2023 года я открыла карту МИР, заранее сообищив, что карта нужна для получения бюджетных выплаты. После получения карты, реквизиты передала в бюджетную организацию. Вчера в ""Мой налог"" увидела, что у меня открыто два р/с, при этом, второго счета в приложении банка не видно. Обратилась в чат, внятного объяснения не получила. Позвонив на горячую линию, мне сообщил, что этот счёт технический и открыт законно (но без моего заявление), ссылаясь на закон, т.к. я получаю бюджетные выплаты. Открыла все платёжки, во всех указан тот р/с, который был изначально и который был передан в бюджетную организацию.  Если у меня изначально была карта МИР, деньги поступали без проблем, для чего нужен технический счёт - непонятно никому. Деньги зачисляются на тот р/с, который предоставлен. Получается, что этот ""технический"" счёт открыт банком с целью получить бонусы, мол мы хорошо работаем, открыли счёт, заплатите нам баллы. Если предположить, что изначальный счёт не бюджетный, то почему банк не предложил мне закрыть его, вместо него передать в бюджетную организацию ""технический"" счёт? Да все просто, сотрудники на открытии счетов зарабатывают. Я отправлю жалобу в ЦБ, возможно, там дадут нормальное разъяснение этому бреду  Кроме этого, банковский бот неверно произносит мое имя, на перезапись отправить не хотят, хотя другой банк без проблем перезаписал и бот правильно ко мне обращается.  P.S. Отзыв написан со страницы мужа.",2024-03-30 08:39:28
"Мариам, огромная Вам благодарность за помощь в открытии ИП. Не только помогли с заполнением заявки, но и подробно проконсультировали по каждому этапу, даже подали идеи. Продуктивно и очень полезно. Именно поэтому я так люблю банк Тинькоф. Лучший, за сервис, за услуги, за цены. Навсегда  ваш клиент ",2024-03-30 08:29:34
"Добрый день! Благодарен сотруднику Виктору В, из отдела помощи прохождения финансовой проверки. Виктор ответил на все мои вопросы и вел меня на протяжении всего процесса решения этой проблемы. Благодаря компетентности Виктора, прошко финансовую проверку меньше, чем за сутки. Очень впечатлен работой Виктора! Спасибо!",2024-03-30 08:24:02
"Сняли деньги за подписку на старте за 3 месяца, прочитал в интернете что Тинькофф поможет вернуть эти деньги, был приятно удивлён что так и есть, единственный банк который поможет вернуть то что тебе принадлежит, без оповещения просто сняли деньги, потому что знают если предупредить человек отменит подписку. Еще раз выражаю благодарность Тинькофф банку.",2024-03-30 06:47:22
"Выражаю благодарность Анне, за ее профессионализм, умение успокоить клиентов, объяснить, лояльно решить их вопросы, погрузиться в решение вопроса и структурно по полочкам ответить на все вопросы. Ситуация в следующем, получил крайне негативный опыт с получением сим карты и оформлением на меня кн (по этому вопросу уже оставлял отзыв негативный на банки ру). В итоге 4 сотрудника не смогли помочь от слова вообще, только благодаря Анне получилось вернуть меня в нормальное общение в чате, получив все ответы. Таких сотрудников как Анна единицы, по крайней мере в этом банке. Спасибо большое, Анна! Тинькофф прошу поощрить максимально сотрудника (денежно), прочитайте чат, сами увидите, какой незаменимый сотрудник в вашем штабе.",2024-03-30 00:09:09
"Заказал карту Тинькофф мобайл. Приехал курьер, выдал карту, все ок. Потом пошли перекрестные продажи, спрашивает меня курьер - есть кредиты в сторонних банках? говорю да, курьер - давайте посчитаем, может выгоднее будет у нас рефинанс сделать, я говорю нет, так как кредит оформлялся до повышения ключевой ставки, но курьер все равно поедложил ознакомиться и проверить, может в итоге будет дешевле и если будет не интересно, то ничего не оформляйте и все будет ок. Кончено там ставка была высокая и невыгодные условия, ничего не стал оформлять.  Захожу домой и опа, пришло сообщение на почту "" вы оформили кредит"", полная стоимость кредита....,  ежемесячный платеж с графиком платеже и ближайший платеж уже в мае, присвоен номер кредитного договора. Это пятница вечер после работы, у меня чуть инфаркт не шлёпнул, потерял несколько часов в чате , вместо того чтобы побыть с семьёй, да, для меня это крайнн серьезно, я очень серьезно отношусь к кредитам!!! Пишу в чат, мне отвечают что это не кредит, это заявка. Что за бред? Загуглите в Вики что такое кредит и что такое заявка. + В личном кабинете отобраюается как оформленный кредит, а не заявка !!!Говорю этот кредит отрбрается в нбки, мне сообщают да . Прошу пояснить что такое одобренная заявка и что такое ""вы оформили кредит"" которые прошло мне на почту ? Тут есть разница? В итоге ещё нбки светится с кредитом. Зачем пугаете клиентов, доводить их, считаете тупым стадом и нелбдями. Прошу срочно принять меры, дать ответы, также будет обращение в ЦБ. На каком основании клиенту приходят такие письма что оформлены продукты банка, когда они не были оформлены ,на каком основании портится кредитная история клиента. Мошенники! Операторы имеют крайне слабую экспертизу, вводят в заблуждение клиента. Не могут ответит ни на один вопрос.",2024-03-29 22:37:00
"Единственный банк, который дает Чарджбек без геморроя, за что хочу дать высокую оценку.    Из последних примеров, сбермаркет и сбермегамаркет грешат тем что не добросовестно выполняют свою работу, не докладывают товар, либо привозят  хрен  пойми что, и оспорить постфактум практически невозможно, ссылаются на свои правила и требуют проверять то что привозит курьер, а когда того спрашиваешь курьера, что чего то не хватает, тот говорит пишите в поддержку я просто курьер, а поддержке, похер, она тебя шлет куда подальше, потому что ты курьеру не сказал что чего то не хватает, замкнутый круг...  Тинькофф же в течении недели рассматривает обращение и сам все возвращает.   И еще тут недавно сбермаркет умудрился списать с карты привязанной Тинькофф 30к, без понятия как, и так же НОЛЬ помощи с их стороны, говорят иди в полицию, мы тебе здесь не поможем заказ сделан с твоего аккаунта и доставлен, ВСЕ! сам виноват.   Что делает Тинькофф? Рассматривает месяц обращение и все возвращает. Лучший просто! Спасибо!  К слову, 25 тыс. вернул в первые дни обращения, даже месяца не пришлось ждать, 5 тыс. там болтались месяц, но в итоге тоже вернули, а обращение в сбермаркете все еще висит на «рассмотрении», пару месяцев уже. ",2024-03-29 22:24:11
"Был задан один единственный вопрос по жалобе, по которой вопрос не решен до сих пор .банк меня проигнорировал и предоставил ответ совсем не то о чем я спрашивал ... Поступило письмо от банка на мою почту о сотрудничестве, так как я самозанятый. В этой сфере из письма я не работаю давно, так как ушел из организации, но кто то мои персональный данные знает и передал без моего согласия в банк, налицо нарушение закона 152-Фз о защите персональных данных. Банк сотрудничает с мошенниками и компанией, которая нарушила закон. Почему вы покрываете нарушителей закона а??? ",2024-03-29 22:21:01
"Хочу похвалить банк Тиньков и его операторов поддержки , всегда во всем помогут , просто самый наилучший банк которым я когда либо пользовалась , а пользовалась я до Тиньков банка , очень многими банками , и Сбер , и синара, газпромбанк , вообщем многими банками пользовалась, и остановилась на Тиньков банке , т.к там всегда радушные и отзывчивые сотрудники , всегда спешат вам на помощь , и помогут найти хороший компромисс в любой ситуации, после Тиньков банка , заблокировала карты всех банка и пользуюсь только им , на другой уже не когда не перейду, вообщем , САМЫЙ ЛУЧШИЙ БАНК , вы просто лучшие во всем мире , замен вам нету , спасибо большое за хорошую работу ",2024-03-29 21:46:16
"пришло СМС на номер телефона с данным текстом: Мы не можем разблокировать ваши карты на основании п. 4.5 и п. 4.9 УКБО. Если решите закрыть счет, отправьте нам распоряжение о закрытии счета в чате или на почту  не предоставили образец заявления на закрытие счета не предоставили почту куда отсылать где искать образец??? на чье имя писать и тд",2024-03-29 21:43:51
Вернули деньги с яндекс.плюса Пришлось поменять кредитную карту Сбербанке с такой же проблемой меня отослали куда подальше оператор Тинькофф сразу понял мою проблему и предложил варианты решение этого вопроса кредитную карту Я не привязывал к сервису яндекс.плюс эта карта была привязана к яндекс.маркету видимо оттуда данные перешли автоматически,2024-03-29 21:31:22
"Сотрудник 82130 за 10 минут ответил на мои вопросы, я никак не мог разобраться с особенностями тарифа по кредитной карте Понравилась его компетентность и легкость в решении моего запроса Причиной тому является ощущение клиентоориентированности, умение слышать клиента и не злоупотреблять скриптами банка Благодарю его за щедрость ",2024-03-29 21:27:30
"У ребенка неожиданно начали списывать деньги с карты. Служба поддержки сработала мониеносно. Вовремя заблокировали карту, чтобы не было списаний. А также в течении суток вернули средства, незаконно списанные с карты. Оспорили неправомерные операции. Очень довольная обслуживанием. Всегда приходят на помощь, без задержек.",2024-03-29 20:56:48
"После просмотра информации об условиях кредита, в мобильном приложении появилась заявка на одобренный кредит на 2М рублей. Согласие на него я не давал. Убрать заявку поддержка отказыается, прелагают ждать звонка сотрудника.  Так вот - вы сделали заявку без моего одобрения, так что прошу и убрать её аналогично! Ждать звонка  и тратить своё время, отвечая  на него -  не собираюсь.   ",2024-03-29 19:20:10
"Обратился через интернет по телефону в банк сотрудница Дарья помогла нам при переводе денег в Узбекистан подсказала досканально что и как перевести деньги как конвертации происходят спасибо всё ок отправили без ℅быстро молодцы спасибо 27,03 2024 года 14,49, минут, далее специалист Дектярь Геннадий помог решить проблему всё карты заблокировали и перевыпустили другие быстро и как всегда молодцы на всё 100℅ нет на 1000℅ спасибо Баку ща таких сотрудников спасибо",2024-03-29 19:10:40
"Банк тинькофф не выходит на связь и бросает трубки, не отвечает в чате  Сотрудница тинькофф банка Виктория 29.03.2024 в 17:58 начала решать вопрос , который не решил предыдущий оператор Дмитрий  В 18:00 сотрудница тинькофф банка Виктория позвонила , в ходе диалога сказала что переведет на другого сотрудника и положила труюку  В 18:07 После этого в чате сотрудница тинькофф банка Виктория – перестала отвечать  На момент 18:30 сотрудница тинькофф банка Виктория – так и не перезвонила  Как будете компенсирвать вашу неудовлетворительную работу? ",2024-03-29 18:32:37
Подключили услугу без моего ведома и списали денежные средства Тинькффф банк списал личные денежные средства клиента и подключил без ведома и без согласия клиента платную услугу  На вопрос зачем подключили? Почему без согласия клиента подключили ? – банк отвечать отказался  Жду возврат денежных средств и обоснование как вы без согласия клиента распоряжаетесь его денежными средствами  ,2024-03-29 18:24:48
